query,intent,product_id
Does 100% Cotton King Percale Duvet Set (3 Piece) Blue Distress Tile Print by Simply Put come with a warranty?,get_warranty_info,161657830
"Where can I find Grande Cosmetics GrandeLash MD Eyelash Formula, 2mL (New Packaging)?",find_product_location,908232424
"Which aisle is SGI Bedding 16 Inch Wrap Around Bed Skirt | Microfiber Bed Skirt | Fade Resistant, Wrinkle Free, Anti-static, Decorative, Extra Storage Space, Clutter-Free | Queen, Light Gray in?",find_product_location,264801526
Can I get Men's The Little Mermaid Vintage Characters  Graphic Tee Turquoise Medium in other sizes or colors?,check_variations,781490570
"Do you have AUSTUFF Swivel Bar Stools Set of 2 Velvet Barstools for Kitchen Island (30"", Blue) in a different size?",check_variations,2834781358
What's your price matching policy?,get_price_match_policy,
Where can I get some Womens One-piece Swimsuits?,find_product_location,2749504314
Can I return items without receipts?,get_return_policy,
"Is there a promotion for Bed Sheet Set 4-Piece Bed Sheet set, Deep Pocket, HypoAllergenic - Queen Sage/Green?",check_price_offer,602315286
What's your price matching policy?,get_price_match_policy,
Where is the Bed Sheets section?,find_product_location,602315286
How many Womens Blouses do you have?,check_stock,5155882858
Where is the clearance area?,check_clearance_section,
"Can I get Bare Home Cozy Fleece Sheet Set - Extra Plush Polar Fleece - Deep Pocket - Split King, Black in other sizes or colors?",check_variations,5292666872
"Can I still buy NELEUS Mens Running Tank Top Dry Fit Y-Back Athletic Workout Tank Tops 3 Pack,Purple+Pink+White,US Size L today?",check_stock,3795586746
"How much does Scoop Women’s V-Neck Top with Volume Sleeves, Sizes XS-XXL cost?",check_price_offer,5291664103
Does LARACE Women's Plus Size Tops 3/4 Sleeve Tunic Shirts Casual Button V-neck Blouse Black 4X come with a warranty?,get_warranty_info,2150292673
Do you provide shipping for LifeStride Womens Suki Pumps - Medium & Wide Width?,get_delivery_options,485354607
Is price matching allowed?,get_price_match_policy,
Do you deliver a.Jesdani Women's Cardigan Classic Casual Lightweight Knit Cardigan Sweaters S-XXL to my home?,get_delivery_options,5184785010
Do you price match other retailers?,get_price_match_policy,
Can I get extended warranty on SONGMICS 3-Tier Shoe Rack with Shelves for Closet Entryway Black?,get_warranty_info,2138573500
Where can I get some Cycling Pants?,find_product_location,1897403279
"Do you have mens jewelry, gift, ring available?",check_stock,5809585615
"Are there other colors available for AUSTUFF Swivel Bar Stools Set of 2 Velvet Barstools for Kitchen Island (30"", Blue)?",check_variations,2834781358
Do you price match other retailers?,get_price_match_policy,
How long is the warranty on Men's The Little Mermaid Vintage Characters  Graphic Tee Turquoise Medium?,get_warranty_info,781490570
"Are there any discounts on pajamas, sleepwear, gown?",check_price_offer,5164703747
Is there a clearance section in this store?,check_clearance_section,
Are there other colors available for Roaman's Women's Plus Size Tall Complete Cotton Seamed Jean?,check_variations,1359948905
Are there alternatives to Ecetana Womens Walking Shoes Lightweight Breathable Mesh Air Cushion Sneakers?,check_variations,283514640
Is the Roaman's Women's Plus Size Tall Complete Cotton Seamed Jean on sale right now?,check_price_offer,1359948905
Is the Victorious Men's Skinny Fit Unwashed Raw Denim Jeans DL938 - Indigo - 32/30 on sale right now?,check_price_offer,871530694
"Do you deliver X RAY JEANS Mens Five Pocket Commuter Pants, Fig, 34X32 to my home?",get_delivery_options,1774083175
When do you expect more Full Bases?,check_restock_status,469036214
Is home delivery available for Zenana Womens & Plus Stretch Cotton Foldover Waist Bootcut Workout Yoga Pants?,get_delivery_options,1897403279
Is there a promotion for a.Jesdani Women's Cardigan Classic Casual Lightweight Knit Cardigan Sweaters S-XXL?,check_price_offer,5184785010
Do you carry different models of Ecetana Womens Walking Shoes Lightweight Breathable Mesh Air Cushion Sneakers?,check_variations,283514640
"Are there any discounts on breathable, walking shoes, womens shoes?",check_price_offer,283514640
Where can I find Georgia Giant Work Boot Size 10.5(W)?,find_product_location,17245067
Does Women's Vanity Fair 75201 Nearly Invisible Full Coverage Underwire Bra (Black 40C) come with a warranty?,get_warranty_info,512809025
"Are there apparel, sleeveless shirt, womens fashion left on the shelf?",check_stock,5219131585
"Do you provide shipping for Exultantex Grey Blackout Curtains for Living Room,Pom Pom Thermal Window Curtains,50""W x 95""L, 2 Panels, Rod Pocket?",get_delivery_options,430528189
Where can I get some Mens Jeans?,find_product_location,1774083175
Which aisle is Disney Boys Graphic Tee Donald Duck Short Sleeves T-Shirt Top Summer Outfits Clothes Sizes 3-10T in?,find_product_location,5397071399
When do you expect more Mens Jeans?,check_restock_status,1774083175
"Are there home goods, pillow sham, bedspread left on the shelf?",check_stock,668480724
"Is there a promotion for Solaray Food Carotene, Vitamin A as Beta Carotene 25000IU | Carotenoids for Healthy Skin &amp; Eyes, Antioxidant Activity &amp; Immune System Support | 200ct?",check_price_offer,179112912
Is there a clearance section in this store?,check_clearance_section,
Is price matching allowed?,get_price_match_policy,
What is the warranty coverage for UVN Sweatshirts for Women Square Neck Long Sleeve Shirts Casual Tunic Tops?,get_warranty_info,5053396247
"Is there a warranty for WestinTrends Julia 10 Ft Outdoor Patio Cantilever Umbrella with Base Included, Market Hanging Offset Umbrella with 4-Pieces Fillable Base Weight, Coffee?",get_warranty_info,469036214
Is price matching allowed?,get_price_match_policy,
How many Womens Two Piece Sets do you have?,check_stock,5702032013
What is the price of a.Jesdani Women's Cardigan Classic Casual Lightweight Knit Cardigan Sweaters S-XXL?,check_price_offer,5184785010
Is a.Jesdani Women's Cardigan Classic Casual Lightweight Knit Cardigan Sweaters S-XXL in stock?,check_stock,5184785010
Is there a warranty for LifeStride Womens Suki Pumps - Medium & Wide Width?,get_warranty_info,485354607
Do you deliver Demotime Men's Polo Shirts Casual Button-Down Shirts Short Sleeve Polo Shirts Blue L V Neck T Shirts Big and Tall Golf Solid Classic Stylish Tops to my home?,get_delivery_options,5702523237
"Do you have jeans, stretch, pants here?",find_product_location,1774083175
"Do you have Solaray Food Carotene, Vitamin A as Beta Carotene 25000IU | Carotenoids for Healthy Skin &amp; Eyes, Antioxidant Activity &amp; Immune System Support | 200ct in a different size?",check_variations,179112912
"Are there other colors available for Mellanni Sheet Set Hotel Luxury Brushed Microfiber, Deep Pocket Sheet, 3 Piece Twin Ivory?",check_variations,6126862324
Can you tell me the restock date for TheLovely Women & Plus Front and Back Reversible Spaghetti Strap Flowy Cami Tank Tops?,check_restock_status,435835263
"Is Caroma Electric Scooter for Adult, 30Miles Range&amp;20Mph Power by 20""Off-Road Tire&amp;Height Adjustable Seat, Foldable Scooter E Bike for Mountains, Snow, Road, Black coming back in stock soon?",check_restock_status,5439347407
Where can I get some Bed Sheets?,find_product_location,602315286
Are there special discounts like military or student?,get_payment_options,
Can I pay with a gift card?,get_payment_options,
"Are there other colors available for Women & Plus Cotton High Waist Full Length Cotton Workout Leggings (BLACK/CHARCOAL, M)?",check_variations,531529503
"Are there alternatives to Caroma Electric Scooter for Adult, 30Miles Range&amp;20Mph Power by 20""Off-Road Tire&amp;Height Adjustable Seat, Foldable Scooter E Bike for Mountains, Snow, Road, Black?",check_variations,5439347407
Can you tell me about store clearance deals?,check_clearance_section,
Where is the clearance area?,check_clearance_section,
Do you carry different models of Ruimatai Women's Plus Size Elastic Waist Guipure Lace Hem Solid Shorts?,check_variations,640096014
Are there special discounts like military or student?,get_payment_options,
"How much does 16"" Handwoven Cotton Throw Pillow Cover with Tufted designs and Side Tassels cost?",check_price_offer,891036133
How much does Amay 800 Thread Count 100% Organic Cotton Short Queen Size 1PC Flat Sheet (90x102 ) Pink Striped cost?,check_price_offer,2363655537
When do you expect more All Makeup?,check_restock_status,411359040
How does your return window work?,get_return_policy,
"Are there any discounts on slim fit, pants, mens fashion?",check_price_offer,1774083175
"Is there a promotion for Rest Haven Upholstered Square Tufted Headboard, Full, Charcoal?",check_price_offer,293084792
"Do you have Mellanni Sheet Set Hotel Luxury Brushed Microfiber, Deep Pocket Sheet, 3 Piece Twin Ivory in a different size?",check_variations,6126862324
Does Aiyino Women's High Waist Yoga Pants Tummy Control Slimming Booty Leggings Workout Running Butt Lift Tights come with a warranty?,get_warranty_info,1341833689
Do you carry different models of Zenana Womens & Plus Stretch Cotton Foldover Waist Bootcut Workout Yoga Pants?,check_variations,1897403279
"What is the warranty coverage for UDPATIO High Back Outdoor Dining Chairs Set of 4, All Weather Swivel Patio Chairs, Breathable Garden Outdoor Furniture for Backyard Deck?",get_warranty_info,5295270812
Is the 100% Cotton King Percale Duvet Set (3 Piece) Blue Distress Tile Print by Simply Put on sale right now?,check_price_offer,161657830
How much does LARACE Women's Tops Long Sleeve Dressy Casual Plus Size Tunic Tops to Wear with Leggings Loose T-Shirt Loose Fit Blouses NavyBlue 1X cost?,check_price_offer,5041920521
"Do you have t-shirt, boys clothing, childrens apparel here?",find_product_location,5397071399
Is there a clearance section in this store?,check_clearance_section,
"Which aisle is 4th of July Women’s Lounger Sleepshirt by Way To Celebrate, Sizes S to 3X in?",find_product_location,5164703747
Do you provide shipping for Hanes Long Sleeve Men T-Shirt 2-Pack Beefy-T Crewneck Soft Cotton Full Cut S-3XL?,get_delivery_options,102593173
"Do you deliver Exclusivo Mezcla Bed Quilt Set Twin Size for All Seasons, Stitched Pattern Quilted Bedspread/ Bedding Set/ Coverlet with 1 Pillow sham, Lightweight and Soft, Turquoise to my home?",get_delivery_options,668480724
"Where can I find Exclusivo Mezcla Bed Quilt Set Twin Size for All Seasons, Stitched Pattern Quilted Bedspread/ Bedding Set/ Coverlet with 1 Pillow sham, Lightweight and Soft, Turquoise?",find_product_location,668480724
Do you accept multiple payment methods?,get_payment_options,
Where can I get some Beta Carotene?,find_product_location,179112912
Do you price match other retailers?,get_price_match_policy,
Where is the Colored Sheets section?,find_product_location,3099936296
What is the warranty coverage for Zenana Women & Plus Basic Cotton Relaxed Fit V-Neck Long Sleeve Plain Active Casual T-ShirtTop(S-3X)?,get_warranty_info,896931395
Is there a shipment incoming for LifeStride Womens Suki Pumps - Medium & Wide Width?,check_restock_status,485354607
Is there a warranty for Laura Mercier Caviar Stick Eye Color Sugar Frost 1.64g/0.05oz?,get_warranty_info,173530386
Where is the Upholstered Headboards section?,find_product_location,293084792
Where is the Shop All Patio Furniture section?,find_product_location,5295270812
"Which aisle is Amay 800TC Organic Cotton Twin XL Size Fitted Sheet ( 39X80 ) Fits Mattress Upto 21 inches Deep Pocket, Ivory Solid in?",find_product_location,1612728569
What's your price matching policy?,get_price_match_policy,
"Do you carry different models of Amay 100% Cotton 600-Thread Count 4-PCs Sheet Set Easily Fit upto 21 Inch Deep Pockets Solid California King, White?",check_variations,2785607950
"Can I get extended warranty on Grande Cosmetics GrandeLash MD Eyelash Formula, 2mL (New Packaging)?",get_warranty_info,908232424
How many Oral Care Accessories do you have?,check_stock,362341632
"What is the price of Rest Haven Upholstered Square Tufted Headboard, Full, Charcoal?",check_price_offer,293084792
"Which aisle is FindChic Men Triple Moon Ring Goddess Fidget Ring,Balck Stress Relief Rotatable Anxiety Ring Size 7 to 14,Send Gift Box in?",find_product_location,3922793394
Where is the Womens Nightshirts & Gowns section?,find_product_location,831123723
Do you accept multiple payment methods?,get_payment_options,
Do you provide shipping for LARACE Women's Tops Long Sleeve Dressy Casual Plus Size Tunic Tops to Wear with Leggings Loose T-Shirt Loose Fit Blouses NavyBlue 1X?,get_delivery_options,5041920521
"Do you deliver SGI Bedding 16 Inch Wrap Around Bed Skirt | Microfiber Bed Skirt | Fade Resistant, Wrinkle Free, Anti-static, Decorative, Extra Storage Space, Clutter-Free | Queen, Light Gray to my home?",get_delivery_options,264801526
When do you expect more Adult Electric Scooters?,check_restock_status,5439347407
Does Disney Boys Graphic Tee Donald Duck Short Sleeves T-Shirt Top Summer Outfits Clothes Sizes 3-10T come with a warranty?,get_warranty_info,5397071399
"Are there stilettos, heels, lifestride left on the shelf?",check_stock,485354607
Is there a warranty for Feather & Stitch 2 Piece Pillowcase Set Standard Size White 100% Cotton Damask Stripe Pillow Cases 500 Thread Count 20x30 Inches Ultra Soft Luxury Sateen Weave Bed Pillow Covers?,get_warranty_info,1097677016
"Are there alternatives to Mellanni Sheet Set Hotel Luxury Brushed Microfiber, Deep Pocket Sheet, 3 Piece Twin Ivory?",check_variations,6126862324
"Is the SmartMouth Original Activated Breath Rinse 16 oz, Adult on sale right now?",check_price_offer,5062553620
"Is there a shipment incoming for Uvplove Women's Summer Loose Casual Short Sleeve Chiffon Top T-Shirt Blouse,Grey,M?",check_restock_status,5155882858
"Do you have nightshirt, pajamas, 4th of july available?",check_stock,5164703747
Do you have IBTOM CASTLE Women's One Piece Rash Guard Swimsuit UV Protection Floral Printed Surfing Zipper Swimwear Bathing Suit Beachwear S Green Leaves in a different size?,check_variations,2749504314
Do you price match other retailers?,get_price_match_policy,
"Do you have work boots, mens shoes, wide shoes here?",find_product_location,17245067
Is price matching allowed?,get_price_match_policy,
Which aisle is nuLOOM Vintage Erline Area Rug in?,find_product_location,904020893
Can I return items without receipts?,get_return_policy,
Can I return items without receipts?,get_return_policy,
Are there alternatives to Amay 800 Thread Count 100% Organic Cotton Short Queen Size 1PC Flat Sheet (90x102 ) Pink Striped?,check_variations,2363655537
Do you price match other retailers?,get_price_match_policy,
"Does Hard Tail Women's French Terry Sweatshirt and Pant Set, 2-Piece, Sizes S-3X come with a warranty?",get_warranty_info,5702032013
"Can I get Exultantex Grey Blackout Curtains for Living Room,Pom Pom Thermal Window Curtains,50""W x 95""L, 2 Panels, Rod Pocket in other sizes or colors?",check_variations,430528189
What's your price matching policy?,get_price_match_policy,
"How long is the warranty on Simply Silver Mint Breath Spray - For Dry Mouth and Freshening, All Natural, Fluoride Free, 2 Fl Oz?",get_warranty_info,362341632
Is there a shipment incoming for Amay 800 Thread Count 100% Organic Cotton Grand King/Super King Size 1PC Flat Sheet (110x125 ) Royal Blue Striped?,check_restock_status,3099936296
Do you price match other retailers?,get_price_match_policy,
What is your return policy?,get_return_policy,
"Do you have plus size, loose fit, tunic here?",find_product_location,5041920521
Is there a promotion for Casual Nights Women's Zipper Front House Dress Sleeveless Seersucker Housecoat Duster Lounger?,check_price_offer,831123723
Is there a clearance section in this store?,check_clearance_section,
How many Shop All Bar Stools & Counter Stools do you have?,check_stock,2834781358
Do you have Jessica London Women's Plus Size Stretch Knit V-Neck Swing Tunic in a different size?,check_variations,6013308220
What's your price matching policy?,get_price_match_policy,
Where can I get some Womens Nightshirts & Gowns?,find_product_location,1892659971
Can I get Disney Boys Graphic Tee Donald Duck Short Sleeves T-Shirt Top Summer Outfits Clothes Sizes 3-10T in other sizes or colors?,check_variations,5397071399
"Is there a shipment incoming for Amay 100% Cotton 600-Thread Count 4-PCs Sheet Set Easily Fit upto 21 Inch Deep Pockets Solid California King, White?",check_restock_status,2785607950
"Do you provide shipping for FindChic Men Triple Moon Ring Goddess Fidget Ring,Balck Stress Relief Rotatable Anxiety Ring Size 7 to 14,Send Gift Box?",get_delivery_options,3922793394
Can I get extended warranty on Zenana Womens & Plus Stretch Cotton Foldover Waist Bootcut Workout Yoga Pants?,get_warranty_info,1897403279
Can you tell me about store clearance deals?,check_clearance_section,
Can I order Hanes Long Sleeve Men T-Shirt 2-Pack Beefy-T Crewneck Soft Cotton Full Cut S-3XL online and pick it up here?,get_delivery_options,102593173
Is there a promotion for LARACE Women's Tops Long Sleeve Dressy Casual Plus Size Tunic Tops to Wear with Leggings Loose T-Shirt Loose Fit Blouses NavyBlue 1X?,check_price_offer,5041920521
When do you expect more Blackout Curtains?,check_restock_status,430528189
How long is the warranty on LARACE Women's Tops Long Sleeve Dressy Casual Plus Size Tunic Tops to Wear with Leggings Loose T-Shirt Loose Fit Blouses NavyBlue 1X?,get_warranty_info,5041920521
"Where can I find Hard Tail Women's French Terry Sweatshirt and Pant Set, 2-Piece, Sizes S-3X?",find_product_location,5702032013
Is there a warranty for Amay 800 Thread Count 100% Organic Cotton Short Queen Size 1PC Flat Sheet (90x102 ) Pink Striped?,get_warranty_info,2363655537
Can I still buy Amay 800 Thread Count 100% Organic Cotton Short Queen Size 1PC Flat Sheet (90x102 ) Pink Striped today?,check_stock,2363655537
Where can I get some Womens Two Piece Sets?,find_product_location,5702032013
Is Jockey Women's Rib Knit Tee in stock?,check_stock,3813188391
"Are there other colors available for 4th of July Women’s Lounger Sleepshirt by Way To Celebrate, Sizes S to 3X?",check_variations,5164703747
Can I get extended warranty on Zenana Women & Plus Basic Cotton Relaxed Fit V-Neck Long Sleeve Plain Active Casual T-ShirtTop(S-3X)?,get_warranty_info,896931395
Do you provide shipping for JWD Womens Nightgown Short Sleeves Sleepwear Soft Loose Sleepshirt Scoopneck Pleated Nightshirt Loungewear?,get_delivery_options,1892659971
Which aisle is Jockey Women's Rib Knit Tee in?,find_product_location,3813188391
"Are there any discounts on all weather, swivel chairs, dining chairs?",check_price_offer,5295270812
"Is home delivery available for SGI Bedding 16 Inch Wrap Around Bed Skirt | Microfiber Bed Skirt | Fade Resistant, Wrinkle Free, Anti-static, Decorative, Extra Storage Space, Clutter-Free | Queen, Light Gray?",get_delivery_options,264801526
Is Roaman's Women's Plus Size Tall Complete Cotton Seamed Jean coming back in stock soon?,check_restock_status,1359948905
"Is there a shipment incoming for 16"" Handwoven Cotton Throw Pillow Cover with Tufted designs and Side Tassels?",check_restock_status,891036133
Do you deliver Casual Nights Women's Zipper Front House Dress Sleeveless Seersucker Housecoat Duster Lounger to my home?,get_delivery_options,831123723
"Are there any discounts on queen size, sheets, flat sheet?",check_price_offer,2363655537
"Are there any discounts on bedroom furniture, upholstered, tufted?",check_price_offer,293084792
Do you deliver UVN Sweatshirts for Women Square Neck Long Sleeve Shirts Casual Tunic Tops to my home?,get_delivery_options,5053396247
Are there special discounts like military or student?,get_payment_options,
How does your return window work?,get_return_policy,
Do you accept multiple payment methods?,get_payment_options,
What is your return policy?,get_return_policy,
Do you accept multiple payment methods?,get_payment_options,
"Are there top, dressy top, apparel left on the shelf?",check_stock,5291664103
Where is the clearance area?,check_clearance_section,
Which aisle is IBTOM CASTLE Women's One Piece Rash Guard Swimsuit UV Protection Floral Printed Surfing Zipper Swimwear Bathing Suit Beachwear S Green Leaves in?,find_product_location,2749504314
"Is Exclusivo Mezcla Bed Quilt Set Twin Size for All Seasons, Stitched Pattern Quilted Bedspread/ Bedding Set/ Coverlet with 1 Pillow sham, Lightweight and Soft, Turquoise in stock?",check_stock,668480724
"Is there a warranty for Uvplove Women's Summer Loose Casual Short Sleeve Chiffon Top T-Shirt Blouse,Grey,M?",get_warranty_info,5155882858
Are there special discounts like military or student?,get_payment_options,
Do you price match other retailers?,get_price_match_policy,
Do you have 100% Cotton King Percale Duvet Set (3 Piece) Blue Distress Tile Print by Simply Put in a different size?,check_variations,161657830
"When will UDPATIO High Back Outdoor Dining Chairs Set of 4, All Weather Swivel Patio Chairs, Breathable Garden Outdoor Furniture for Backyard Deck be restocked?",check_restock_status,5295270812
"Are there any discounts on palette, eyeshadow, makeup?",check_price_offer,411359040
What's your price matching policy?,get_price_match_policy,
"Do you have womens shoes, block heels, sandals here?",find_product_location,1017487270
Where is the clearance area?,check_clearance_section,
Do you accept multiple payment methods?,get_payment_options,
"Can I track my order for J. Adams Camila Sandals for Women, Square Open Toe Strappy Mid Block Heels, Elegant &amp; Comfortable, Perfect for Weddings?",get_delivery_options,1017487270
Are there special discounts like military or student?,get_payment_options,
"Can I get extended warranty on VOUA Electric Heated Mattress Pad, White King?",get_warranty_info,1727244137
"What is the price of FindChic Men Triple Moon Ring Goddess Fidget Ring,Balck Stress Relief Rotatable Anxiety Ring Size 7 to 14,Send Gift Box?",check_price_offer,3922793394
Is there a clearance section in this store?,check_clearance_section,
"How long is the warranty on Mellanni Sheet Set Hotel Luxury Brushed Microfiber, Deep Pocket Sheet, 3 Piece Twin Ivory?",get_warranty_info,6126862324
"Where can I find Bare Home Cozy Fleece Sheet Set - Extra Plush Polar Fleece - Deep Pocket - Split King, Black?",find_product_location,5292666872
Can I get extended warranty on Laura Mercier Caviar Stick Eye Color Sugar Frost 1.64g/0.05oz?,get_warranty_info,173530386
Is there a clearance section in this store?,check_clearance_section,
"Do you carry different models of Hard Tail Women's French Terry Sweatshirt and Pant Set, 2-Piece, Sizes S-3X?",check_variations,5702032013
Can I pay with a gift card?,get_payment_options,
"Do you have UDPATIO High Back Outdoor Dining Chairs Set of 4, All Weather Swivel Patio Chairs, Breathable Garden Outdoor Furniture for Backyard Deck in a different size?",check_variations,5295270812
Is price matching allowed?,get_price_match_policy,
Which aisle is Ecetana Womens Walking Shoes Lightweight Breathable Mesh Air Cushion Sneakers in?,find_product_location,283514640
Is there a clearance section in this store?,check_clearance_section,
Is price matching allowed?,get_price_match_policy,
"What is the price of Solaray Food Carotene, Vitamin A as Beta Carotene 25000IU | Carotenoids for Healthy Skin &amp; Eyes, Antioxidant Activity &amp; Immune System Support | 200ct?",check_price_offer,179112912
Are there other colors available for Jessica London Women's Plus Size Stretch Knit V-Neck Swing Tunic?,check_variations,6013308220
Are there special discounts like military or student?,get_payment_options,
"Are there any discounts on home decor, living room, home goods?",check_price_offer,904020893
Can I pay with a gift card?,get_payment_options,
"Is Amay 800TC Organic Cotton Twin XL Size Fitted Sheet ( 39X80 ) Fits Mattress Upto 21 inches Deep Pocket, Ivory Solid in stock?",check_stock,1612728569
Can I track my order for Casual Nights Women's Zipper Front House Dress Sleeveless Seersucker Housecoat Duster Lounger?,get_delivery_options,831123723
"Is SGI Bedding 16 Inch Wrap Around Bed Skirt | Microfiber Bed Skirt | Fade Resistant, Wrinkle Free, Anti-static, Decorative, Extra Storage Space, Clutter-Free | Queen, Light Gray coming back in stock soon?",check_restock_status,264801526
"Which aisle is SmartMouth Original Activated Breath Rinse 16 oz, Adult in?",find_product_location,5062553620
Are there alternatives to Georgia Giant Work Boot Size 10.5(W)?,check_variations,17245067
"What is the price of NELEUS Mens Running Tank Top Dry Fit Y-Back Athletic Workout Tank Tops 3 Pack,Purple+Pink+White,US Size L?",check_price_offer,3795586746
How long is the warranty on Ruimatai Women's Plus Size Elastic Waist Guipure Lace Hem Solid Shorts?,get_warranty_info,640096014
Can you tell me about store clearance deals?,check_clearance_section,
Do you provide shipping for Demotime Men's Polo Shirts Casual Button-Down Shirts Short Sleeve Polo Shirts Blue L V Neck T Shirts Big and Tall Golf Solid Classic Stylish Tops?,get_delivery_options,5702523237
"What is the price of Uvplove Women's Summer Loose Casual Short Sleeve Chiffon Top T-Shirt Blouse,Grey,M?",check_price_offer,5155882858
Are there special discounts like military or student?,get_payment_options,
Is there a warranty for Victorious Men's Skinny Fit Unwashed Raw Denim Jeans DL938 - Indigo - 32/30?,get_warranty_info,871530694
"Do you have casual wear, volume sleeves, v-neck here?",find_product_location,5291664103
When do you expect more Throw Pillow Covers?,check_restock_status,891036133
What is the warranty coverage for 100% Cotton King Percale Duvet Set (3 Piece) Blue Distress Tile Print by Simply Put?,get_warranty_info,161657830
